id,제품명,제품회사,분류,성분,효능,용법,저장방법
278,쿨탑정,천우신약(주),청계제약(주)," 수산화알루민산마그네슘, 염산라니티딘, 산화마그네슘, 규산알루민산마그네슘","위통, 속쓰림, 소화불량, 구역","성인(15세이상,80세미만) : 1회 2정씩 복용하되 복용 후 5시간 이상 지나도 증상이 완화되지 않으면 다시 2정을 복용하십시오. 단, 1일 2회(4정)을 넘지 않도록 하십시오.",DUR성분(성분1/성분2..병용성분)유당
279,씨메이저후르츠쥬니어정,에이프로젠제약(주),20031017," 리보플라빈3배산, 50%초산토코페롤, 콜레칼시페롤과립, 염산피리독신3배산, 오로트산, 제피아스코르빈산, 침강탄산칼슘, 판토텐산칼슘","* 다음 경우의 비타민 보급 : 육체피로, 임신, 수유기, 병중, 병후의 체력저하시, 발육기.","3세 ～ 12세 미만 어린이 : 1회 2정, 1일 3회입안에서 녹이거나 씹어서 복용한다.",기밀용기. 실온보관(1～30℃) 
280,후리졸정(알벤다졸),에이프로젠제약(주),내수용(주)한국파비스제약, 알벤다졸,"회충, 요충, 십이지장충, 편충, 아메리카 구충, 분선충의 감염 및 이들 혼합감염의 치료","1. 성인 및 24개월 이상의 소아는 아래의 양을 복용1) 요충 : 1일 1회 알벤다졸로서 400 mg을 복용한다. 박멸을 위하여 7일 뒤, 한번만 더 이 약으로서 400 mg을 복용한다.2) 회충, 십이지장충, 편충, 아메리카구충 : 이 약으로서 400 mg을 단회 복용한다.3) 분선충의 다른 기생충(조충)과 중증 혼합 감염시 : 1일 1회 이 약으로서 400 mg 씩 3일간 복용한다. 삼키기 어려울 경우 씹거나 소량의 물로 복용할 수 있으며 식사를 중단하거나 하제를 쓰는 등의 특별한 과정은 필요 없다(정제, 저작정에 한함). 치료 3주 후 검사를 하여 치료되지 않았으면 경우에 따라 2차 투여를 실시할 수 있다.",DUR성분(성분1/성분2..병용성분)유당
281,미야스톱캡슐,에이프로젠제약(주),20031027," 차질산비스무스, 클로스트리디움부티리쿰미아이리2588균, 스코폴리아엑스, 우루소데스옥시콜린산, 염화베르베린","설사, 복통을 수반하는 설사, 식체, 묽은변, 토사",1회 15세이상 2캡슐8세이상  15세 미만 : 1캡슐을 1일 3회 식후 복용한다,DUR성분(성분1/성분2..병용성분)유당
282,에스코판정,에이프로젠제약(주),일반의약품," L멘톨, 디시클로민염산염, 파파베린염산염, 우르소데옥시콜산","위통,복통,산통, 위산과다,속쓰림","15세 이상 성인 : 1회 2정 1일 2∼3회, 11세이상 15세미만 : 1회 1⅓정 1일 2∼3회, 8세 이상∼11세미만 : 1회 1정 1일 2∼3회 식후 또는 식전에 복용한다.다만, 1일 2회 이상 복용시에는 4시간 이상의 간격을 두고 복용한다",DUR성분(성분1/성분2..병용성분)유당
283,디아패시드정(치옥트산)(수출용),삼천당제약(주),전문의약품, 치옥트산,당뇨병성 다발성 신경염의 완화," 성인 : 치옥트산으로서 1일 200～600mg을 2～3회 분할하여 식사 30분전에 특별한 처방이 없는 한 씹지말고 약간의 물과 함께 경구투여 한다.연령, 증상에 따라 적절히 증감한다.",DUR성분(성분1/성분2..병용성분)유당
284,케프란점안액(푸마르산케토티펜)(수출명:케토레그점안액),삼천당제약(주),20030115, 푸마르산케토티펜,알러지성 결막염,"성인: 1회1적, 1일 24회 또는 상태에 따라 적절히 점안한다유.소아: 의사의 처방에 따른다.","기밀용기,상온 (15~25℃)보관"
285,신폴에프점안액(수출명:산클점안액),삼천당제약(주),20030117," 수용성아줄렌, 설파메톡사졸나트륨, 아미노에틸설폰산, 글리시리진산디칼륨","결막염(유행성 결막염), 다래끼, 안검염(눈꺼풀의 진무름), 눈의 가려움","1회 13방울, 1일 36회 점안한다.","기밀용기,실온보관(1~30도)보관"
286,록세트캡슐75mg(록사티딘아세테이트염산염),삼천당제약(주),(주)유영제약, 록사티딘아세테이트염산염 과립 45.45%,"위·십이지장궤양, 역류성식도염, 졸링거엘리슨증후군, 위산이 흡인될 위험(Mendelson,s syndrome)이 있는 환자의 마취전 투여, 특히 분만중인 환자의 마취전 투여, 다음질환의 위점막병변 : (미란, 출혈, 발적, 부종)의 개선, 급성위염, 만성위염의 급성 악화기","성인 :1) 위·십이지장궤양, 역류성 식도염, 졸링거엘리슨 증후군 : 염산록사티딘아세테이트로서 1회 75mg 1일 2회 아침, 저녁 식후에 경구투여 한다.위ㆍ십이지장궤양의 경우 1회 150mg, 1일 1회 저녁에 투여할 수도 있다.위·십이지장궤양의 경우 대개 4주이내에 치료가 되지만, 증상소실은 수일 내 나타난다. 치료를 시작한지 4주후에도 완치되지 않는 환자의 경우에는 동일용량을 2주간 더 투여해야 한다.크레아티닌 청소율이 20～50mL/분 정도로 신기능이 손상된 환자의 경우에는 1회 75mg 1일 1회 저녁에 투여한다.크레아티닌 청소율이 20mL/분 이하의 경우에는 1회 75mg 2일 1회 저녁에 투여한다.2) 급성위염, 만성위염의 급성 악화기 : 1회 75mg 1일 1회 저녁식후 또는 취침시에 투여한다.3) 마취전 투여 : 1회 75mg을 2회(수술전일 취침시 및 수술당일 마취도입 2시간전) 투여한다.연령, 증상에 따라 적절히 증감한다.",제품명록세트캡슐75mg(록사티딘아세테이트염산염)
287,레푸로진시럽(레보드로프로피진),삼천당제약(주),전문의약품, 레보드로프로피진,다음 질환에서의 기침 : 급·만성기관지염,"성인 : 레보드로프로피진으로서 1회 60 mg을 1일 3회 적어도 6시간 간격을 두고 경구투여한다.소아 : 레보드로프로피진으로서 적어도 6시간 간격을 두고 투여한다.10～20 kg : 1회 18 mg을 1일 3회 경구투여한다.20～30 kg : 1회 30 mg을 1일 3회 경구투여한다.연령, 증상에 따라 적절히 증감한다.",DUR성분(성분1/성분2..병용성분)레보드로프로피진
288,아이젠에스연질캡슐,삼천당제약(주),일반의약품," 비타민A, 리보플라빈부티레이트, 마늘엑스(100>1), 아스코르브산, 감마오리자놀, 토코페롤아세테이트",": 어깨, 목결림, 수족저림.수족냉증",성인 1일 1회 1캡슐씩 식후에 복용,"기밀용기, 실온(1~30℃)보관"
289,아세클정(아세클로페낙),삼천당제약(주),신풍제약(주), 아세클로페낙,"류마티스관절염, 강직척추염, 골관절염(퇴행관절염) 및 견갑상완골의 관절주위염, 치통, 외상 후 생기는 염증, 요통, 좌골통, 비관절성 류머티즘으로 인한 통증", 성인 : 아세클로페낙으로서 1회 100 mg을 12시간마다 1일 2회 복용한다. 간장애 환자 : 초기 용량으로 1일 100 mg을 투여한다.이 약은 씹거나 부수지 말고 그대로 복용한다.증상에 따라 적절히 증감한다.이 약의 심혈관계 이상반응을 최소화하기 위해 최저 유효 용량으로 최단 기간 동안 투여해야 한다.,DUR성분(성분1/성분2..병용성분)케토롤락아세클로페낙
290,레토스건조시럽(클래리트로마이신제피과립),삼천당제약(주),전문의약품, 클래리트로마이신제피과립, 유효균종,"보통 소아 체중 Kg당 7.5mg을 12시간마다(15mg/Kg/day) 투여한다. 투여기간은 보통 5～10일이다. 이 약은 음식물에 의한 생체이용율의 변화가 없으므로 식사와 관계없이 투여한다. 식사와 함께 또는 우유와 함께 복용할 수 있다크레아티닌청소율이 30mL/min이하인 신부전 환자의 경우에는 용량을 절반으로 줄여야 한다. 이런 환자에게는 14일 이상 투여하지 않는다. 미코박테리아 감염증소아 체중 Kg당 7.5～15mg을 12시간마다(15～30mg/Kg/day) 투여한다. 임상적 개선이 관찰되면 지속적으로 투여하여야 한다. 에탐부톨, 클로파지민, 리팜핀과 같은 다른 항미코박테리아제와 병용 투여하여야 한다.<이 약의 조제법>적량의 물을 넣고 잘 흔들어 용해시킨다. 조제된 이 약의 농도는 125mg/5mL이다. 포장단위  물의 양  조제된 총용량  조제된 농도  750mg/30mL  17mL  30mL  125mg/5mL  1,500mg/60mL  33mL  60mL  125mg/5mL  2,500mg/100mL  55mL  100mL  125mg/5mL  11,250mg/450mL  248mL  450mL  125mg/5mL 조제된 약은 15～30℃에서 보관하고(냉장보관 하지 말 것), 14일 이내에 사용한다. 투여하기 전에 흔들어 사용한다.",DUR성분(성분1/성분2..병용성분)할로페리돌클래리트로마이신
291,헤라콜시럽(아이비엽70%에탄올유동엑스),삼천당제약(주),일반의약품, 아이비엽70%에탄올유동엑스,"만성 염증성 기관지 질환의 증상 개선, 기침을 동반한 호흡기의 급성 염증 완화",(시럽제)(유동엑스제)(현탁제)성인 및 15세 이상 : 아이비엽70%에탄올유동엑스로서 1회 100 mg을 1일 3회 복용한다.4～14세 : 이 약으로서 1회 100 mg을 1일 2회 복용한다.2～3세 : 이 약으로서 1회 50 mg을 1일 3회 복용한다.(정제)성인 및 15세 이상 : 아이비엽70%에탄올유동엑스로서 1회 100 mg을 1일 3회 복용한다.,"기밀용기, 실온(1∼30℃)보관"
292,세포독스캡슐100mg(세픽심)(수출명:세레록스)(수출용),삼천당제약(주),20030818, 세픽심,"연쇄구균(장내구균제외), 폐렴연쇄구균, 임균, 모락셀라 카타랄리스, 대장균, 클레브시엘라, 세라티아, 프로테우스, 인플루엔자균","(캡슐제) 성인 및 체중 30 Kg 이상의 소아 : 세픽심으로서 1회 50～100mg(역가) 1일 2회 경구투여한다. 중증 또는 효과가 불충분한 경우에는 1회 200mg(역가) 1일 2회 투여한다.연령, 증상에 따라 적절히 증감한다.(산제) 소아 : 세픽심으로서 1회 체중 Kg 당 1.5～3mg(역가) 1일 2회 경구투여한다. 중증 또는 효과가 불충분한 경우에는 1회 체중 Kg당 6mg(역가) 1일 2회 투여 한다.연령, 증상에 따라 적절히 증감한다.","밀폐용기, 실온(130℃)보관"
293,테라스타정2밀리그람(염산테라조신),삼천당제약(주),전문의약품, 염산테라조신,"양성전립선비대에 의한 배뇨장애, 고혈압(경증중등도)","이 약은 다른 약물이 부적절하거나 비효과적일 경우 단독 또는 치아짓계 이뇨제 및 다른 혈압강하제와 병용요법으로 투여할 수 있다. 음식물은 이 약의 생체내이용률에 거의 또는 전혀 영향을 미치지 않으므로 식사와 관계없이 투여할 수 있다. 연령, 증상에 따라 적절히 증감한다.\xa01. 양성전립선비대에 의한 배뇨장애 성인1) 초회량염산테라조신으로서 초회량으로 취침전 1mg을 경구투여하며, 이 용량을 초과해서는 안된다. 초회투여로 인한 급성 저혈압 발현 가능성을 최소화하기 위하여 초회 투여의 복약상태를 신중히 관찰한다.2) 유지량이 약으로써 증상이 개선될 때까지 천천히 증량한다. 유지량으로 1일 1회 510mg을 경구투여한다.3) 치아짓계 이뇨제 및 다른 혈압강하제와 병용투여 : 치아짓계 이뇨제 또는 다른 혈압강하제와 병용투여하는 경우에는 이 약의 용량을 감량하며 필요한 경우 증량한다. 이러한 병용투여 요법시 저혈압이 나타날 수 있으므로 신중히 관찰한다.2. 고혈압용량은 환자의 혈압반응에 따라 조절한다. 성인1) 초회량염산테라조신으로서 초회량으로 취침전 1mg을 경구투여하며, 이 용량을 초과해서는 안된다. 초회투여로 인한 급성 저혈압 발현 가능성을 최소화하기 위하여 초회 투여의 복약상태를 신중히 관찰한다.2) 유지량① 단독투여 : 유지량으로 1일 1회 210mg을 투여하며 아침 또는 저녁에 복용하되 계속해서 같은 시간에 투여하는 것이 바람직하다. 바람직한 혈압반응을 얻기 위해 1주간격으로 용량을 2배로 증량할 수 있다. 20mg 이상의 용량을 투여해도 더 큰 효과를 나타내지는 않으며 40mg 이상의 용량 투여에 관한 연구는 실시된 바 없다.② 치아짓계 이뇨제 및 다른 혈압강하제와 병용투여 : 치아짓계 이뇨제 또는 다른 혈압강하제와 병용투여하는 경우에는 이 약의 용량을 감량하며 필요한 경우 증량한다. 이러한 병용투여 요법시 저혈압이 나타날 수 있으므로 신중히 관찰한다.",DUR성분(성분1/성분2..병용성분)테라조신
294,엔디스캡슐(에르도스테인),삼천당제약(주),일반의약품, 에르도스테인,급ㆍ만성 호흡기질환에서의 점액용해 및 거담,성인: 에르도스테인으로서 1회 300 mg을 1일 2～3회 경구투여한다.급성 호흡기질환에 투여 시 연속으로 10일 이상 투여하지 않는다.,DUR성분(성분1/성분2..병용성분)에르도스테인
295,디어메디정2밀리그람(글리메피리드)(수출명:글루메디정2밀리그람),삼천당제약(주),전문의약품, 글리메피리드,1) 초기용량 및 용량결정,"각 환자에 대해 개별적으로 조절한다. 물 1/2컵 이상과 함께 씹지 않고 삼킨다. 이 약은 1일 1회 경구투여한다. 이 약은 아침식사 전 또는 첫번째 식사직전에 복용해야 한다. 이 약 복용 후에 식사를 거르지 않는 것이 매우 중요하다.1. 단독요법1) 초기용량 및 용량결정이전에 약물을 투여 받은 적이 없는 환자에 대해서는 1일 1회, 글리메피리드로서 1 mg으로 투약을 시작한다. 필요할 경우, 1 ～ 2주의 간격을 두고 1 mg씩 용량을 증가시킨다. 일반적으로 4 mg 이상의 용량을 투여했을 때 추가효과는 거의 없지만, 몇몇 환자들은 6 mg(또는 8 mg)까지 증량시킴으로써 더 나은 대사조절을 보였다. 1일 4 mg 투여가 실패하면, 먼저 인슐린 요법으로의 전환을 고려해 보고 그렇지 않으면 인슐린 또는 기타 경구용 당뇨병약과의 병용을 고려해야 한다.2) 2차 용량조절치료가 진행됨에 따라 당뇨병 조절상태가 호전됨으로써 이 약의 필요량이 감소할 수 있다. 그러므로 저혈당을 피하기 위해 감량이나 이 약의 투여중단이 필요할 수도 있다. 체중감소, 생활방식의 변화, 또는 저혈당 또는 고혈당을 일으킬 위험성을 증가시킬만한 기타요인이 발생했을 때도 용량조절을 고려해야 한다.3) 다른 경구용 혈당강하제에서 이 약으로의 전환이 약 및 다른 경구용 혈당강하제 사이에 정확한 용량 상관관계는 없다. 다른 경구용 혈당강하제를 투여하다가 이 약으로 전환할 경우에는 초기용량 항에서 제시한 방법을 따르는 것이 좋다. 즉, 1일 1 mg으로 투여를 시작하고 1 ～ 2주 간격으로 용량을 조절할 수 있다. 이전에 투여하던 약물의 효력 및 작용지속정도를 고려해야 한다.4) 투약조절이 약을 복용하는 동안, 혈당 또는/및 요당수준을 규칙적으로 측정해야 하고, 또한 당화헤모글로빈(HbA1c) 수준을 규칙적으로 측정하는 것도 권장된다. 일반적으로, 저혈당은 곧바로 당을 섭취함으로써 즉시 조절된다. 설포닐우레아계 약물을 투여했을 때 초기에 성공적으로 대처했음에도 불구하고 저혈당이 재발할 수 있다. 그러므로 환자를 주의 깊게 관찰해야 한다. 심한 저혈당의 경우에는 의사의 즉각적인 처치 및 추적관찰이 필요하고 때때로 입원치료가 필요하다.2. 병용요법1) 인슐린과의 병용요법이 약과 인슐린의 병용요법은 2차적 실패 환자에게 사용하며 공복혈당(FBG)이 150 mg/dL을 넘을 경우 인슐린과의 병용요법을 사용한다. 이 약은 1일 1회 첫번째 식사와 함께 8 mg을 투여하며, 인슐린은 저용량으로 시작하여 공복혈당 측정치에 따라 대략 일주일 간격으로 증량한다. 안정화되면, 가능한 한 날마다 모세혈당을 모니터링 해야 한다. 혈당과 당화헤모글로빈을 측정하면서 주기적으로 인슐린의 용량을 조절하는 것이 필요하다.2) 메트포르민과의 병용요법환자가 이 약의 최대용량에 적절히 반응하지 않을 경우, 메트포르민의 추가를 고려할 수 있다. 글리벤클라미드, 글리피자이드, 클로르프로파마이드, 톨부타마이드 등의 기타 설포닐우레아계 제제와 메트포르민의 병용요법에 대해 발표된 임상정보가 존재한다. 이 약과 메트포르민의 병용요법시, 각각의 약물의 용량을 조절함으로써 원하는 혈당에 도달할 수 있다. 그러나 혈당조절을 위한 각 약물의 최소 유효용량을 알아내기 위한 노력이 이루어져야 한다. 이 약과 메트포르민의 병용투여시 저혈당의 위험이 존재하며 위험이 증가할 수도 있다. 적절한 주의가 이루어져야 한다.",DUR성분(성분1/성분2..병용성분)글리메피리드
296,티프라마정(염산티로프라미드),삼천당제약(주),전문의약품, 염산티로프라미드,ㆍ성인 : 염산티로프라미드로서 1회 100㎎ 1일 23회 경구투여한다.,"ㆍ성인 : 염산티로프라미드로서 1회 100㎎ 1일 23회 경구투여한다.ㆍ연령, 증상에 따라 적절히 증감한다.","기밀용기, 실온보관(130℃)"
297,이미파신주(황산이세파마이신),삼천당제약(주),20031211, 황산이세파마이신, 유효균종," 성인 : 이세파마이신으로서 1일 400mg(역가)을 1～2회로 분할 근육 또는 점적 정맥주사 한다. 점적 정맥주사 시 1일 1회의 경우 1시간, 2회의 경우 30분～1시간동안 주입한다. 유‧소아(1～12세) : 1일 체중 Kg당 15mg의 용량을 2회로 분할(12시간 간격) 근육 또는 30분 동안 점적 정맥주사 한다.연령, 증상에 따라 적절히 증감한다.","밀봉용기, 실온(130℃)보관"
298,로나졸캡슐50밀리그램(플루코나졸),삼천당제약(주),전문의약품, 플루코나졸,약물투여경로는 환자의 임상상태에 따라 결정한다.,"약물투여경로는 환자의 임상상태에 따라 결정한다.경구제제의 흡수는 빠르고 거의 완전하게 흡수되므로, 경구제제(캡슐, 건조시럽)와 주사제제의 투여량은 같다. 성인1. 질칸디다증: 플루코나졸로서 150 mg 단회 경구투여2. 점막 칸디다증1) 구강 인두 칸디다증: 이 약으로서 보통 1일 1회 50 mg을 714일간 투여하며 의사의 판단에 따라 연장 투여할 수 있다.2) 만성 위축성 구강칸디다증(의치로 인한 구강 내 통증): 이 약으로서 보통 1일 1회 50 mg을 14일간 투여하며 의치의 국소 소독을 병행해야 한다.3) 기타 점막 칸디다증 (질칸디다증을 제외한 식도칸디다증, 비침습성 기관지 폐감염증, 칸디다뇨증, 피부 점막 칸디다증 등): 이 약으로서 보통 1일 1회 50 mg을 1430일간 투여하며 난치성 점막 칸디다증의 경우에는 1일 1회 100 mg으로 증량할 수 있다.3. 칸디다혈증, 파종성 칸디다증 및 그 외의 침습성 칸디다 감염증(복막, 심내막, 폐, 비뇨기계 등)을 포함한 전신칸디다증: 이 약으로서 보통 첫날 400 mg을 1회 투여하고 다음날부터 1일 1회 200 mg을 투여하며, 환자의 반응에 따라 1일 1회 400 mg까지 증량할 수 있다. 투여기간은 임상적 반응 및 의학적 판단에 따라 결정한다.4. 크립토콕쿠스 수막염 및 다른 부위의 크립토콕쿠스증: 이 약으로서 보통 첫날 400 mg을 1회 투여하고 다음날부터 1일 1회 200400 mg을 투여한다. 치료기간은 임상반응 및 진균학적 반응에 의해 결정되나 보통 최소한 6 ~ 8주간 투여해야 한다.5. AIDS 환자의 크립토콕쿠스 수막염 재발 방지를 위해서는 환자가 기초 치료를 모두 받은 후 이 약으로서 1일 1회씩 200 mg을 무기한 투여한다.6. 세포독성화학요법이나 방사선요법, 골수이식으로 인한 호중구 감소증으로 인해 진균 감염증의 위험이 있는 면역부전 환자의 진균 감염증 예방: 환자의 진균 감염증에 걸릴 위험정도에 따라 이 약으로서 1일 1회 50400 mg을 투여하여야 한다. 전신성 진균 감염증의 위험이 매우 높은 환자, 즉 골수이식의 경우와 같이 호중구 감소증이 심하거나 호중구 감소증 기간이 길 것으로 예상되는 환자에게는 1일 1회 400 mg을 권장한다. 이러한 환자에게는 호중구 감소증이 시작되리라고 예상되는 56일전부터 400 mg을 투여하여야 하며 호중구수가 1,000 cells/mm3이상으로 증가된 후에도 1주일 동안 계속 400 mg 을 투여하여야 한다.7. 손∙발톱진균증에는 1주 1회 150 mg씩 투여하며, 투여기간은 손, 발톱이 다시 자랄 때까지 (감염되지 않은 새로운 손, 발톱이 자랄 때까지) 투여한다. 새로운 손톱이 자라는데 걸리는 기간은 보통 36개월, 발톱의 경우 612개월 정도 걸리며 성장속도는 개인별로 연령에 따라 다를 수 있다. 장기간 투여로 성공적으로 치료한 후 때때로 손, 발톱이 손상된 채로 있는 경우도 있다.무좀(족부백선), 체부백선, 완선(샅백선), 피부칸디다증을 포함한 피부 진균감염증: 이 약으로서 보통 1일 1회 50 mg 또는 1주 1회 150 mg을 24주간 투여한다. 그러나 무좀의 경우 경과에 따라 6주간 투여가 필요할 수도 있다. 어루러기는 1일 1회 50 mg을 24주간 투여한다. 소아성인용량에 근거한 소아용량은 일반적으로 다음과 같은 기준을 적용하며, 최대 400 mg 을 초과하지 않는다. 성인용량  소아용량  100 mg  3 mg/kg  200 mg  6 mg/kg  400 mg  12 mg/kg 단, 생후 6개월 미만의 영아에 대한 안전성, 유효성이 확립되어 있지 않다(사용상의 주의사항 참조).1. 구강 인두 칸디다증이 약으로서 첫날 체중 kg당 6 mg을 투여하고, 다음날부터 1일 1회 체중 kg당 3 mg을 투여한다. 재발방지를 위해 최소 2주간 투여해야 한다.2. 식도 칸디다증이 약으로서 첫날 체중 kg당 6 mg이며, 다음날부터는 1일 1회 체중 kg당 3 mg을 투여한다. 환자의 반응에 따라 1일 1회 체중 kg당 12 mg까지 증량할 수 있다. 최소 3주간, 증상 소실 후 적어도 2주간 투여한다.3. 칸디다혈증, 파종성 칸디다증 및 그 외의 다른 침습성 칸디다 감염증(복막, 심내막, 폐, 비뇨기계 등)을 포함한 전신 칸디다증1일 1회 체중 kg당 612 mg의 용량을 투여한다. 투여기간은 임상적 반응 및 의학적 판단에 따라 결정한다.4. 크립토콕쿠스 수막염이 약으로서 첫날 체중 kg당 12 mg을 투여하고, 다음날부터 1일 1회 체중 kg당 6 mg을 투여한다. 환자의 반응에 따라 1일 1회 체중 kg당 12 mg으로 증량할 수 있다. 치료기간은 뇌척수액 배양 음성 소견이 있은 후 1012주간 동안 투여한다.5. AIDS환자의 크립토콕쿠스 수막염의 재발방지를 위해서는 환자가 기초치료를 모두 받은 후 1일 1회 체중 kg당 6 mg을 투여한다.6. 신장애 소아는 신장애 정도에 따라 성인 신장애 환자와 동일한 기준으로 투여간격을 늘리고 용량을 줄여야 한다. 10 mg미만의 용량을 투여할 때는 정확한 양을 맞추기 위해 소아의 임상적 상태에 따라 시럽제를 경구투여하거나, 주사제를 정맥주사 하여야 한다. 고령자신기능이 정상인 경우에는 보통 성인 용량을 투여하며 신장애가 있을 때에는(크레아티닌 청소율 50 mL/min이하) 투여용량을 줄이거나 투여간격을 늘려야 한다. 신장애 환자이 약은 변화되지 않은 채 주로 소변을 통해 배설된다. 한번만 투여하는 경우에는 용량조절이 필요 없으나 여러 번 투여해야 하는 경우에는 투여첫날에만 상용량을 투여하고 다음날부터는 다음과 같이 용량을 조절해야 한다. 크레아티닌 청소율(mL/min)  권장되는 투여용량  > 50 ≤50 (투석하지 않음) 혈액투석 환자  상용량의 100 % 상용량의 50% 각 혈액투석 후에 상용량의 100% 혈액투석을 받는 환자의 경우 각 혈액투석 후에 상용량의 100%를 투여해야 한다. 투석을 하지 않는 날에는 크레아티닌 청소율에 따라 감량하여 투여해야 한다.",DUR성분(성분1/성분2..병용성분)플루코나졸에리트로마이신
299,안국레보설피리드정,안국약품(주),광동제약(주), 레보설피리드,"기능성소화불량으로 인한 다음 증상의 완화: 복부팽만감, 상복부불쾌감, 속쓰림, 트림, 구역, 구토",성인 : 레보설피리드로서 1회 25 mg을 1일 3회 식전에 경구투여한다.,DUR성분(성분1/성분2..병용성분)유당
300,슬리그린캡슐,안국약품(주),(주)휴온스," 다엽가루, 오르소시폰가루",비만 또는 과체중시 체중감량(줄임) 보조제,"성인 : 1회 1 ∼ 2캡슐, 1일 3회 식사 중에 큰 컵으로 물 한 컵과 함께 복용한다.",차광기밀용기   실온(130℃)보관
